{
  "profile": "memory.local-source-query.v2", "ok": true, "status": "empty", "error": "",
  "query": {"action": "range_batch", "start_at": "2026-09-08T00:00:00+08:00", "end_at": "2026-09-11T00:00:00+08:00"},
  "sources": [],
  "batch": {"batch_id": "sbb_0000000000000001", "work_id": "sbw_0000000000000001", "sequence": 1, "stop_reason": "eof", "next_batch_cursor": null, "expires_at": "2026-10-08T00:02:00Z"},
  "coverage": {
    "traversal": {"scope": "current_session_only", "time_basis": "message_observation", "interval": "[start,end)", "order": "message_time_asc", "eof": true, "processed_messages": 0, "cumulative_messages": 0, "first_source_ref": null, "last_source_ref": null, "unknown_message_time": "excluded_from_time_order"},
    "presentation": {"status": "complete", "returned_messages": 0, "returned_fragments": 0, "suppressed_messages": 0, "cumulative_completed_messages": 0, "cumulative_fragments": 0, "cumulative_chars": 0, "cumulative_suppressed_messages": 0, "pending_excerpt": false},
    "interpretation": {"event_coverage": "not_established", "current_context": "unknown", "capture_coverage": "not_established"},
    "dependencies": {"validity_mode": "global", "source_revision": "1", "policy_revision": "1"}
  },
  "usage": {"step": 1, "remaining_steps": 2, "model_calls": 0, "read_count": 0, "returned_chars": 0, "returned_bytes": 1367, "elapsed_ms": 0, "limits": {"max_bytes": 12288, "max_messages": 48, "max_fragments": 64, "excerpt_chars": 800}, "host_context_budget": "unknown"}
}
